{"schema_version":"1.0","scanner":{"name":"SCAN","version":"1.0.0"},"network":"127.0.0.1/32","target":{"input":"127.0.0.1/32","network":"127.0.0.1/32","ip_version":4,"candidate_hosts":1},"timestamp":"2026-08-20T00:00:00.000Z","duration_ms":0,"summary":{"active_hosts":0,"hosts_scanned":0,"ports_scanned":0,"total_open_ports":0,"total_closed_ports":0,"total_errors":0},"hosts":[],"metadata":{"discovery":"icmp","ports":[],"ping_timeout_seconds":1.0,"connect_timeout_seconds":1.0,"workers":1,"max_hosts":1}}
